[
  {
    "coverage_assertion": {
      "assertion_type": "WHOLE_ARTIFACT_COVERAGE_ASSERTION",
      "member_count": 15,
      "member_manifest_sha256": "977d1eb41daf1b55c088af0dd165ad47a2008e867b9e735e925dd70599220456",
      "unaccounted_license_relevant_member_count": 0
    },
    "coverage_decision": "COVERS_ENTIRE_ARTIFACT",
    "coverage_id": "sentencepiece-windows-v0.2.1-production-license-coverage",
    "coverage_record_sha256": "08cd8bde4876fe9f9986fa410c621966912a3b69fc9ac3f8d1ef2e507db0f13a",
    "coverage_selector": {
      "exclude": [],
      "explicit_member_paths": [],
      "include": ["*"],
      "selector_type": "ENTIRE_ARTIFACT",
      "semantics_version": "1"
    },
    "covered_subject": {
      "artifact_type": "PYTHON_WHEEL",
      "filename": "sentencepiece-0.2.1-cp313-cp313-win_amd64.whl",
      "package": "sentencepiece",
      "sha256": "10ed3dab2044c47f7a2e7b4969b0c430420cdd45735d78c8f853191fa0e3148b",
      "version": "0.2.1"
    },
    "evidence_source": {
      "evidence_sha256": "cfc7749b96f63bd31c3c42b5c471bf756814053e847c10f3eb003417bc523d30",
      "license_path": "sentencepiece-0.2.1/sentencepiece/LICENSE",
      "license_sha256": "cfc7749b96f63bd31c3c42b5c471bf756814053e847c10f3eb003417bc523d30",
      "source_archive_sha256": "8138cec27c2f2282f4a34d9a016e3374cd40e5c6e9cb335063db66a0a3b71fad",
      "source_type": "UPSTREAM_RELEASE_LICENSE",
      "upstream_binding_id": "sentencepiece-windows-release-v0.2.1-production"
    },
    "license_assertion": { "relationship": "WHOLE_ARTIFACT", "spdx_expression": "Apache-2.0" },
    "review_provenance": {
      "authority": "code-c-license-coverage-producer",
      "review_reference": "CODE_C_WINDOWS_SENTENCEPIECE_LICENSE_COVERAGE_REVIEW",
      "review_status": "REQUIRES_REVIEW"
    },
    "schema_version": "1"
  }
]
