[{"coverage_assertion":{"assertion_type":"WHOLE_ARTIFACT_COVERAGE_ASSERTION","member_count":18,"member_manifest_sha256":"7dfd3baf3d94996a339b1f2be5d504d997fadfc8b7b024fbd5659126892ab84b","unaccounted_license_relevant_member_count":0},"coverage_decision":"COVERS_ENTIRE_ARTIFACT","coverage_id":"sentencepiece-linux-v0.2.1-production-license-coverage","coverage_record_sha256":"57fd9f0dcacacd99c626300ab8725582ae3b1af345ffc370941a11c4b47ce079","coverage_selector":{"exclude":[],"explicit_member_paths":[],"include":["*"],"selector_type":"ENTIRE_ARTIFACT","semantics_version":"1"},"covered_subject":{"artifact_type":"PYTHON_WHEEL","filename":"sentencepiece-0.2.1-cp313-cp313-manylinux_2_27_x86_64.manylinux_2_28_x86_64.whl","package":"sentencepiece","sha256":"c7f0fd2f2693309e6628aeeb2e2faf6edd221134dfccac3308ca0de01f8dab47","version":"0.2.1"},"evidence_source":{"evidence_sha256":"cfc7749b96f63bd31c3c42b5c471bf756814053e847c10f3eb003417bc523d30","license_path":"sentencepiece-0.2.1/sentencepiece/LICENSE","license_sha256":"cfc7749b96f63bd31c3c42b5c471bf756814053e847c10f3eb003417bc523d30","source_archive_sha256":"8138cec27c2f2282f4a34d9a016e3374cd40e5c6e9cb335063db66a0a3b71fad","source_type":"UPSTREAM_RELEASE_LICENSE","upstream_binding_id":"sentencepiece-linux-release-v0.2.1-production"},"license_assertion":{"relationship":"WHOLE_ARTIFACT","spdx_expression":"Apache-2.0"},"review_provenance":{"authority":"code-c-license-coverage-producer","review_reference":"CODE_C_LINUX_SENTENCEPIECE_LICENSE_COVERAGE_REVIEW","review_status":"REQUIRES_REVIEW"},"schema_version":"1"}]
